{
  "$schema": "http://json-schema.org/draft-04/schema#",
  "id": "",
  "type": "object",
  "properties": {
    "urn": {
      "id": "/urn",
      "type": "string"
    },
    "id": {
      "id": "/id",
      "type": "string"
    },
    "policeOfficerInCase": {
      "id": "/policeOfficerInCase",
      "type": "object",
      "properties": {
        "personId": {
          "id": "/policeOfficerInCase/personId",
          "type": "string"
        },
        "rank": {
          "id": "/policeOfficerInCase/rank",
          "type": "string"
        },
        "narrative": {
          "id": "/policeOfficerInCase/narrative",
          "type": "string"
        },
        "badgeNumber": {
          "id": "/policeOfficerInCase/badgeNumber",
          "type": "integer"
        }
      }
    },
    "policeSupervisor": {
      "id": "/policeSupervisor",
      "type": "object",
      "properties": {
        "personId": {
          "id": "/policeSupervisor/personId",
          "type": "string"
        },
        "rank": {
          "id": "/policeSupervisor/rank",
          "type": "string"
        },
        "narrative": {
          "id": "/policeSupervisor/narrative",
          "type": "string"
        },
        "badgeNumber": {
          "id": "/policeSupervisor/badgeNumber",
          "type": "integer"
        }
      }
    }
  },
  "required": [
    "urn",
    "id",
    "policeOfficerInCase",
    "policeSupervisor"
  ]
}

