{
  "urn": "22C22222222",
  "id": "7e2f843e-d639-40b3-8611-8015f3a18958",
  "policeOfficerInCase": {
            "personId": "aa746921-d839-4867-bcf9-b41db8ebc852",
            "rank": "constable",
            "narrative":"",
            "badgeNumber": 223
  },
  "policeSupervisor": {
            "personId": "ab746921-d839-4867-bcf9-b41db8ebc852",
            "rank": "sergeant",
            "narrative":"",
            "badgeNumber": 223
  }
}
